name,id,tags,rarity,base price,stack size,cargo space,icon,sound id,sound id drop,plugin,plugin params,desc,order
,,,,,,,,,,,,,
Mayasuran Navy Blueprint Package,mayasura_package,package_bp,0.5,50000,1000,1,graphics/icons/cargo/blueprint_midline.png,ui_chip_pickup,ui_bp_package_drop,com.fs.starfarer.api.campaign.impl.items.MultiBlueprintItemPlugin,mayasura_bp,"Enables heavy industry to construct the more common ship hulls, weapons, and fighter LPCs from the Mayasuran Navy.",266
Mayasuran Navy Warship Blueprint Package,mayasura_w_package,package_bp,0.2,200000,1000,1,graphics/icons/cargo/blueprint_midline.png,ui_chip_pickup,ui_bp_package_drop,com.fs.starfarer.api.campaign.impl.items.MultiBlueprintItemPlugin,mayasura_w_bp,Enables heavy industry to construct the heavier warships from the Mayasuran Navy.,267
Mayasuran Navy Capital Blueprint Package,mayasura_c_package,package_bp,0.1,400000,1000,1,graphics/icons/cargo/blueprint_midline.png,ui_chip_pickup,ui_bp_package_drop,com.fs.starfarer.api.campaign.impl.items.MultiBlueprintItemPlugin,mayasura_c_bp,Enables heavy industry to construct the capitals from from the Mayasuran Navy.,268
Mayasuran Prime Warship Blueprint Package,mayasura_e_package,"package_bp, no_drop",0.1,1000000,1000,1,graphics/icons/cargo/blueprint_basic.png,ui_chip_pickup,ui_bp_package_drop,com.fs.starfarer.api.campaign.impl.items.MultiBlueprintItemPlugin,mayasura_e_bp,A set of blueprints that enable heavy industry to produce the near-legendary hulls employed by the Mayasuran Navy. The continued existence - and location - of these blueprints is forever lost to the annals of time.,269
Mayasuran Navy Weapon Blueprint Package,mayasura_wp_package,package_bp,0.5,50000,1000,1,graphics/icons/cargo/blueprint_midline.png,ui_chip_pickup,ui_bp_package_drop,com.fs.starfarer.api.campaign.impl.items.MultiBlueprintItemPlugin,mayasura_wp_bp,Enables heavy industry to construct the weapon LPCs from the Mayasuran Navy.,270
